{
  "matrix_id": "C1-partial-token-shape-2026-07-23",
  "profile_id": "P-TOKEN-SHAPE-v0",
  "created_utc": "2026-07-23T16:30:00Z",
  "git_tag": "case1-partial-2026-07",
  "idp_versions": {
    "keycloak": "quay.io/keycloak/keycloak:26.0.7",
    "wso2is": "wso2/wso2is:7.0.0"
  },
  "config_equivalence": {
    "passed": false,
    "checklist_id": "CE-TOKEN-SHAPE-v0",
    "checklist_path": "results/case1-partial/config-equivalence-CE-TOKEN-SHAPE-v0.json",
    "notes": "Grant type and requested scopes matched (password + openid profile email). Access/refresh lifetimes NOT equated (KC 300s vs WSO2 3600s). JWT access-token issuance NOT equated (KC JWT; WSO2 opaque). Claim-attribute mapping proxy NOT equated. See CE-TOKEN-SHAPE-v0 for observables, evidence paths, and thresholds."
  },
  "rows": [
    {
      "feature": "password_grant_openid_issues_tokens",
      "expected": "HTTP 200, token_type Bearer, refresh_issued true, id_token JWT contains claim key sub",
      "observed": {
        "keycloak": {
          "http_status": 200,
          "token_type": "Bearer",
          "refresh_issued": true,
          "claim_keys_id_has_sub": true
        },
        "wso2is": {
          "http_status": 200,
          "token_type": "Bearer",
          "refresh_issued": true,
          "claim_keys_id_has_sub": true
        }
      },
      "verdict": "same",
      "notes": "Both IdPs completed password+openid on itl-lab. Full fixture paths: fixtures/keycloak-token-raw.json, fixtures/wso2-token-raw.json."
    },
    {
      "feature": "access_token_is_jwt",
      "expected": "Access-token JWT-ness matches only after JWT access-token config is equated; until then do not narrate as product superiority",
      "observed": {
        "keycloak": {
          "access_token_is_jwt": true,
          "claim_keys_access_count": 20
        },
        "wso2is": {
          "access_token_is_jwt": false,
          "claim_keys_access_count": 0
        }
      },
      "verdict": "config_drift",
      "impact": "Migrators that decode access tokens as JWTs will see rich claim_keys_access on Keycloak and an empty set on default WSO2 IS 7.0.0 (opaque token). Equate JWT access-token settings before any implementation_drift claim on access-token claims.",
      "notes": "Honest comparative cell for this partial lab evidence pin. Opaque vs JWT is a lab-config / product-default difference under unmatched equivalence checklist."
    },
    {
      "feature": "token_lifetime_expires_in",
      "expected": "expires_in matches only after access-token lifetimes are equated on the checklist; until then do not narrate as product superiority",
      "observed": {
        "keycloak": {
          "expires_in": 300
        },
        "wso2is": {
          "expires_in": 3600
        }
      },
      "verdict": "config_drift",
      "impact": "Clients hardcoding refresh timing or assuming a shared access-token lifetime will behave differently across these IdP defaults (300s vs 3600s). Equate token lifetimes before any implementation_drift claim on expiry semantics.",
      "notes": "Numeric expires_in from field extraction v0; this row assigns the framework verdict so readers are not left to invent one. Lifetimes were explicitly NOT equated on CE-TOKEN-SHAPE-v0."
    },
    {
      "feature": "id_token_claim_key_set_email_profile",
      "expected": "After requesting profile+email scopes, id_token claim-key set includes email only after claim-attribute mapping is equated; until then do not narrate as product superiority",
      "observed": {
        "keycloak": {
          "has_email": true
        },
        "wso2is": {
          "has_email": false
        }
      },
      "verdict": "config_drift",
      "impact": "Clients that assume an ID token will carry email after requesting the email scope will work against Keycloak defaults and fail silently against WSO2 IS defaults on this pin. Equate claim-attribute mapping before any implementation_drift claim on ID-token claim sets.",
      "notes": "Promoted from CE-TOKEN-SHAPE-v0 item id_token_claim_key_set_email_profile (equated: false; required_for_implementation_drift: true). Minimal proxy: membership of email in claim_keys_id from field extraction v0."
    }
  ]
}
